{
  "$schema": "http://json-schema.org/draft-07/schema#",
  "$id": "phase-capsule-v1",
  "title": "PHASE-CAPSULE",
  "description": "Phase-summary projection. Canonical = .planning + git; capsule = projection. NEVER source of truth.",
  "type": "object",
  "additionalProperties": false,
  "required": [
    "schema_version",
    "milestone",
    "phase",
    "phase_name",
    "status",
    "goal",
    "outputs",
    "files",
    "decisions",
    "debt",
    "downstream_contract",
    "bypass_refs",
    "source_commits",
    "source_hashes",
    "gates",
    "created_at",
    "created_by"
  ],
  "properties": {
    "schema_version": { "type": "integer", "const": 1 },
    "milestone": { "type": "string", "minLength": 1 },
    "phase": { "type": "string", "minLength": 1 },
    "phase_name": { "type": "string" },
    "status": {
      "type": "string",
      "enum": ["PASS", "PASS-WITH-DEFERRED-N", "FAIL", "UNKNOWN", "IN_PROGRESS"]
    },
    "goal": { "type": "string" },
    "outputs": {
      "type": "array",
      "items": { "$ref": "#/definitions/PhaseOutput" }
    },
    "files": {
      "type": "array",
      "items": { "type": "string" },
      "uniqueItems": true
    },
    "decisions": {
      "type": "array",
      "items": { "$ref": "#/definitions/Decision" }
    },
    "debt": { "$ref": "#/definitions/DebtCounts" },
    "downstream_contract": { "$ref": "#/definitions/DownstreamContract" },
    "bypass_refs": {
      "type": "array",
      "items": { "$ref": "#/definitions/BypassRef" }
    },
    "source_commits": {
      "type": "array",
      "items": { "$ref": "#/definitions/GitCommit" }
    },
    "source_hashes": { "$ref": "#/definitions/SourceHashes" },
    "gates": { "$ref": "#/definitions/GateOutcomes" },
    "token_cost": {
      "oneOf": [
        { "$ref": "#/definitions/TokenCostRefs" },
        { "type": "null" }
      ]
    },
    "created_at": {
      "type": "string",
      "pattern": "^[0-9]{4}-[0-9]{2}-[0-9]{2}T"
    },
    "created_by": { "type": "string" },
    "compression_level": {
      "oneOf": [
        { "type": "string", "enum": ["raw_evidence","phase_capsule","validated_thought","reusable_rule","guardrail"] },
        { "type": "null" }
      ]
    },
    "promoted_at": {
      "oneOf": [
        { "type": "string", "pattern": "^[0-9]{4}-[0-9]{2}-[0-9]{2}T" },
        { "type": "null" }
      ]
    },
    "demoted_at": {
      "oneOf": [
        { "type": "string", "pattern": "^[0-9]{4}-[0-9]{2}-[0-9]{2}T" },
        { "type": "null" }
      ]
    },
    "revoked_at": {
      "oneOf": [
        { "type": "string", "pattern": "^[0-9]{4}-[0-9]{2}-[0-9]{2}T" },
        { "type": "null" }
      ]
    },
    "revoked_reason": {
      "oneOf": [
        { "type": "string" },
        { "type": "null" }
      ]
    },
    "allowed_consumers": {
      "oneOf": [
        { "type": "array", "items": { "type": "string" } },
        { "type": "null" }
      ]
    },
    "revalidation_due": {
      "oneOf": [
        { "type": "boolean" },
        { "type": "null" }
      ]
    },
    "supersedes_id": {
      "oneOf": [
        { "type": "string" },
        { "type": "null" }
      ]
    },
    "superseded_by_id": {
      "oneOf": [
        { "type": "string" },
        { "type": "null" }
      ]
    },
    "revocation_path": {
      "oneOf": [
        { "type": "string" },
        { "type": "null" }
      ]
    }
  },
  "definitions": {
    "PhaseOutput": {
      "type": "object",
      "required": ["kind", "path"],
      "properties": {
        "kind": { "type": "string" },
        "path": { "type": "string" },
        "exports": { "type": "array", "items": { "type": "string" } },
        "contract": { "type": "string" },
        "tests_run": { "type": "array", "items": { "type": "string" } }
      },
      "additionalProperties": false
    },
    "Decision": {
      "type": "object",
      "required": ["id", "source", "text"],
      "properties": {
        "id": { "type": "string" },
        "source": { "type": "string" },
        "text": { "type": "string" }
      },
      "additionalProperties": false
    },
    "DebtCounts": {
      "type": "object",
      "required": [
        "critical_added",
        "warnings_added",
        "edge_guard_miss_added",
        "deferred_added",
        "carried_forward_total"
      ],
      "properties": {
        "critical_added": { "type": ["integer", "null"] },
        "warnings_added": { "type": ["integer", "null"] },
        "edge_guard_miss_added": { "type": ["integer", "null"] },
        "deferred_added": { "type": ["integer", "null"] },
        "carried_forward_total": { "type": ["integer", "null"] }
      },
      "additionalProperties": false
    },
    "DownstreamContract": {
      "type": "object",
      "required": ["consumers", "constraints", "extension_points"],
      "properties": {
        "consumers": { "type": "array", "items": { "type": "string" } },
        "constraints": { "type": "array", "items": { "type": "string" } },
        "extension_points": { "type": "array", "items": { "type": "string" } }
      },
      "additionalProperties": false
    },
    "BypassRef": {
      "type": "object",
      "required": ["stream", "id", "kind", "summary_passthrough", "evidence_path"],
      "properties": {
        "stream": { "type": "string" },
        "id": { "type": "string" },
        "kind": { "type": "string" },
        "summary_passthrough": { "type": "string" },
        "evidence_path": { "type": ["string", "null"] },
        "tagged_for_milestone": { "type": ["string", "null"] }
      },
      "additionalProperties": false
    },
    "GitCommit": {
      "type": "object",
      "required": ["sha", "subject", "ts"],
      "properties": {
        "sha": { "type": "string", "pattern": "^[0-9a-f]{40}$" },
        "subject": { "type": "string" },
        "ts": { "type": "string" }
      },
      "additionalProperties": false
    },
    "SourceHashes": {
      "type": "object",
      "required": ["context", "research", "plan", "verification", "atc_review"],
      "properties": {
        "context": {
          "oneOf": [{ "$ref": "#/definitions/HashedFile" }, { "type": "null" }]
        },
        "research": {
          "oneOf": [{ "$ref": "#/definitions/HashedFile" }, { "type": "null" }]
        },
        "plan": {
          "type": "array",
          "items": { "$ref": "#/definitions/HashedFile" }
        },
        "verification": {
          "oneOf": [{ "$ref": "#/definitions/HashedFile" }, { "type": "null" }]
        },
        "atc_review": {
          "oneOf": [{ "$ref": "#/definitions/HashedFile" }, { "type": "null" }]
        }
      },
      "additionalProperties": false
    },
    "HashedFile": {
      "type": "object",
      "required": ["path", "sha256"],
      "properties": {
        "path": { "type": "string" },
        "sha256": { "type": "string", "pattern": "^[0-9a-f]{64}$" }
      },
      "additionalProperties": false
    },
    "GateOutcomes": {
      "type": "object",
      "properties": {
        "verifier": { "oneOf": [{ "type": "object" }, { "type": "null" }] },
        "atc_review": { "oneOf": [{ "type": "object" }, { "type": "null" }] },
        "phase_level_atc_runs": { "type": "array" },
        "codex_runs": { "type": "array" },
        "review_verdict": { "oneOf": [{ "type": "object" }, { "type": "null" }] }
      },
      "additionalProperties": true
    },
    "TokenCostRefs": {
      "type": "object",
      "additionalProperties": {
        "oneOf": [{ "type": "object" }, { "type": "null" }]
      }
    }
  }
}
