{
  "schema_version": 1,
  "milestone": "v3.5",
  "phase": "147",
  "phase_name": "Commit Seam Gate",
  "status": "UNKNOWN",
  "goal": "",
  "outputs": [
    {
      "kind": "atc_review",
      "path": ".planning/milestones/v3.5/phases/147-commit-seam-gate/147-ATC-REVIEW.md"
    },
    {
      "kind": "research",
      "path": ".planning/milestones/v3.5/phases/147-commit-seam-gate/147-RESEARCH.md"
    },
    {
      "kind": "verification",
      "path": ".planning/milestones/v3.5/phases/147-commit-seam-gate/147-VERIFICATION.md"
    }
  ],
  "files": [],
  "decisions": [],
  "debt": {
    "critical_added": 0,
    "warnings_added": 0,
    "edge_guard_miss_added": 0,
    "deferred_added": 0,
    "carried_forward_total": 0
  },
  "downstream_contract": {
    "consumers": [],
    "constraints": [],
    "extension_points": []
  },
  "bypass_refs": [],
  "source_commits": [],
  "source_hashes": {
    "context": null,
    "research": {
      "path": ".planning/milestones/v3.5/phases/147-commit-seam-gate/147-RESEARCH.md",
      "sha256": "536d3ed67fc70cff1069e3518f1b79e4f0a36da82c42b6dd71b58e8a86c40bfe"
    },
    "plan": [],
    "verification": {
      "path": ".planning/milestones/v3.5/phases/147-commit-seam-gate/147-VERIFICATION.md",
      "sha256": "6bc42e116c360a0a50c11f1185bd38f9b0988b87f0e5835ef3b5f44d50a05e86"
    },
    "atc_review": {
      "path": ".planning/milestones/v3.5/phases/147-commit-seam-gate/147-ATC-REVIEW.md",
      "sha256": "a76980506ef9d3a0dc4584365157bf3427dee903b08ea08e0ce706a522b61336"
    }
  },
  "gates": {
    "verifier": {
      "verdict": "UNKNOWN",
      "ref": ".planning/milestones/v3.5/phases/147-commit-seam-gate/147-VERIFICATION.md"
    },
    "atc_review": {
      "path": ".planning/milestones/v3.5/phases/147-commit-seam-gate/147-ATC-REVIEW.md",
      "verdict": "unknown",
      "crit_count": 0,
      "warn_count": 0
    },
    "phase_level_atc_runs": [],
    "codex_runs": [
      {
        "run_id": "2026-08-07T11:18:59Z",
        "exit": 6,
        "fallback_triggered": false
      },
      {
        "run_id": "2026-08-07T11:28:43Z",
        "exit": 6,
        "fallback_triggered": false
      },
      {
        "run_id": "2026-08-07T11:39:17Z",
        "exit": 0,
        "fallback_triggered": false
      },
      {
        "run_id": "2026-08-07T12:04:00Z",
        "exit": 0,
        "fallback_triggered": false
      },
      {
        "run_id": "2026-08-07T13:46:26Z",
        "exit": 6,
        "fallback_triggered": false
      },
      {
        "run_id": "2026-08-07T14:25:37Z",
        "exit": 0,
        "fallback_triggered": false
      },
      {
        "run_id": "2026-08-07T14:52:36Z",
        "exit": 0,
        "fallback_triggered": false
      },
      {
        "run_id": "2026-08-07T14:56:55Z",
        "exit": 5,
        "fallback_triggered": false
      }
    ],
    "review_verdict": null
  },
  "token_cost": null,
  "created_at": "2026-08-07T15:00:15.229Z",
  "created_by": "super-gsd/tools/phase-capsule/write.cjs@85765df46f9d"
}
