{
  "schema_version": 1,
  "milestone": "v3.8-fleet-cockpit",
  "phase": "163",
  "phase_name": "Fleet Page",
  "status": "IN_PROGRESS",
  "goal": "",
  "outputs": [],
  "files": [
    ".planning/milestones/v3.8-fleet-cockpit/INTENT.md",
    ".planning/milestones/v3.8-fleet-cockpit/ROADMAP.md",
    ".planning/milestones/v3.8-fleet-cockpit/phases/161-hook-distribution-completion/CONTEXT.md",
    ".planning/milestones/v3.8-fleet-cockpit/phases/162-fleet-service/CONTEXT.md",
    ".planning/milestones/v3.8-fleet-cockpit/phases/163-fleet-page/163-01-PLAN-LOCKED.md",
    ".planning/milestones/v3.8-fleet-cockpit/phases/163-fleet-page/163-01-PLAN-PROMPT.md",
    ".planning/milestones/v3.8-fleet-cockpit/phases/163-fleet-page/163-01-PLAN-REPORT.md",
    ".planning/milestones/v3.8-fleet-cockpit/phases/163-fleet-page/163-01-PLAN-REV2-PROMPT.md",
    ".planning/milestones/v3.8-fleet-cockpit/phases/163-fleet-page/163-01-PLAN-REV2-REPORT.md",
    ".planning/milestones/v3.8-fleet-cockpit/phases/163-fleet-page/163-PLANREVIEW-PROMPT.md",
    ".planning/milestones/v3.8-fleet-cockpit/phases/163-fleet-page/163-PLANREVIEW-REPORT.md",
    ".planning/milestones/v3.8-fleet-cockpit/phases/163-fleet-page/163-PLANREVIEW2-PROMPT.md",
    ".planning/milestones/v3.8-fleet-cockpit/phases/163-fleet-page/163-PLANREVIEW2-REPORT.md",
    ".planning/milestones/v3.8-fleet-cockpit/phases/163-fleet-page/163-T1-PROMPT.md",
    ".planning/milestones/v3.8-fleet-cockpit/phases/163-fleet-page/163-T1-REPORT.md",
    ".planning/milestones/v3.8-fleet-cockpit/phases/163-fleet-page/163-T2-PROMPT.md",
    ".planning/milestones/v3.8-fleet-cockpit/phases/163-fleet-page/163-T2-REPORT.md",
    ".planning/milestones/v3.8-fleet-cockpit/phases/163-fleet-page/CONTEXT.md",
    ".planning/milestones/v3.8-fleet-cockpit/phases/164-omnigent-session-plane/CONTEXT.md",
    ".planning/milestones/v3.8-fleet-cockpit/phases/165-fleet-event-emission/CONTEXT.md",
    "super-gsd/docs/FLEET-COCKPIT.md",
    "super-gsd/tools/fleet-cockpit/public/app.js",
    "super-gsd/tools/fleet-cockpit/public/index.html",
    "super-gsd/tools/fleet-cockpit/run-self-test.cjs",
    "super-gsd/tools/fleet-cockpit/server.cjs"
  ],
  "decisions": [],
  "debt": {
    "critical_added": 0,
    "warnings_added": null,
    "edge_guard_miss_added": 0,
    "deferred_added": 0,
    "carried_forward_total": 0
  },
  "downstream_contract": {
    "consumers": [],
    "constraints": [],
    "extension_points": []
  },
  "bypass_refs": [],
  "source_commits": [
    {
      "sha": "e87a52c3e3ef8fe7ca50eb8265e7df74942fcb03",
      "subject": "docs(v3.8): milestone planned from devcp fleet-cockpit handover \u2014 P161-P163 + gated P164/P165",
      "ts": "2026-08-20T23:20:36+01:00"
    },
    {
      "sha": "c498c01a0d18dffca27c2f71e111f166ded27db1",
      "subject": "docs(163): activate phase + planner prompt",
      "ts": "2026-08-21T09:52:45+01:00"
    },
    {
      "sha": "0369e2e6f234cd14738ac915f8c13f7c432aa395",
      "subject": "docs(163-01): PLAN-LOCKED \u2014 page + structural contract tests, schema VALID",
      "ts": "2026-08-21T10:14:41+01:00"
    },
    {
      "sha": "ef7f2484eae4bca4081456e8acf7c8a4a630464e",
      "subject": "docs(163-01): plan rev 2 after NOGO \u2014 production-invoking rail/formatter SACs, re-VALID",
      "ts": "2026-08-21T10:27:20+01:00"
    },
    {
      "sha": "bb8522ec2378692620d5efbe61d1aa942c6533b2",
      "subject": "docs(163): plan reviews \u2014 NOGO round 1, GO round 2",
      "ts": "2026-08-21T10:29:33+01:00"
    },
    {
      "sha": "e590ca49fe3c03319a89a7cafb672da01e0ddc56",
      "subject": "feat(163-T1): the fleet page \u2014 no framework, house palette, exported pure renderers",
      "ts": "2026-08-21T10:56:18+01:00"
    },
    {
      "sha": "a9b5c93d76931744e67da5ec0c768c347f65ba39",
      "subject": "feat(163-T2): production-backed page contracts \u2014 suite 589/589, static route added",
      "ts": "2026-08-21T11:18:04+01:00"
    }
  ],
  "source_hashes": {
    "context": null,
    "research": null,
    "plan": [],
    "verification": null,
    "atc_review": null
  },
  "gates": {
    "verifier": null,
    "atc_review": null,
    "phase_level_atc_runs": [],
    "codex_runs": [
      {
        "run_id": "2026-08-21T09:14:43Z",
        "exit": 0,
        "fallback_triggered": false
      },
      {
        "run_id": "2026-08-21T09:27:21Z",
        "exit": 0,
        "fallback_triggered": false
      },
      {
        "run_id": "2026-08-21T10:18:06Z",
        "exit": 0,
        "fallback_triggered": false
      }
    ],
    "review_verdict": null
  },
  "token_cost": null,
  "created_at": "2026-08-21T10:26:50.558Z",
  "created_by": "super-gsd/tools/phase-capsule/write.cjs@a9b5c93d7693"
}
